{
  "$schema": "./game.schema.json",
  "name": "Beginners Guide",
  "author": "mousetail",
  "publication_date": "2026-10-16",
  "edition": "Trouble Brewing",
  "bag": {
    "tokens": [
      "Imp",
      "Baron",
      { "thinks": "Investigator", "actual": "Drunk" },
      "Saint",
      "Empath",
      "Ravenkeeper",
      "Washerwoman"
    ],
    "bluffs": ["Fortune Teller", "Mayor", "Butler"]
  },
  "players": [
    {
      "death_status": "alive",
      "name": "Alice",
      "role": "Fortune Teller",
      "information": [
        {
          "night": 1,
          "information": "P5 & P4: No"
        },
        {
          "night": 2,
          "information": "P2 & P3: Yes"
        },
        {
          "night": 3,
          "information": "P5 & P2: Yes"
        }
      ]
    },
    {
      "death_status": "alive",
      "name": "Bob",
      "role": "Saint",
      "information": []
    },
    {
      "name": "Charlie",
      "death_status": "alive",
      "role": "Investigator",
      "information": [
        {
          "night": 1,
          "information": "Either P6 or P7 is a poisoner"
        }
      ]
    },
    {
      "name": "Deboarah",
      "role": "Ravenkeeper",
      "death_status": {
        "cause": "demon",
        "night": 2
      },
      "information": [
        {
          "night": 2,
          "information": "P6 is the baron"
        }
      ]
    },
    {
      "name": "Ethiene",
      "role": "Washerwoman",
      "death_status": {
        "cause": "demon",
        "night": 3
      },
      "information": [
        {
          "night": 1,
          "information": "Either p4 or p6 is the Ravenkeeper"
        }
      ]
    },
    {
      "name": "Felix",
      "role": "Mayor",
      "death_status": {
        "cause": "execution",
        "day": 2
      }
    },
    {
      "name": "Giovani",
      "role": "Empath",
      "death_status": {
        "cause": "execution",
        "day": 1
      },
      "information": [
        {
          "night": 1,
          "information": "2 neighbours are evil"
        }
      ]
    }
  ],
  "timeline": [
    {
      "day": 1,
      "executed": [7],
      "nominated": [2],
      "voted": [1, 2, 3, 4, 5, 6]
    },
    {
      "night": 2,
      "day": 2,
      "executed": [6],
      "nominated": [1, 3],
      "voted": [1, 2, 3, 4, 5, 6],
      "deaths_at_night": [4]
    },
    {
      "night": 3,
      "deaths_at_night": [5]
    }
  ]
}
